{
    "datapackage": {
        "profile": "tabular-data-package",
        "resources": [
            {
                "encoding": "windows-1252",
                "format": "csv",
                "mediatype": "text/csv",
                "name": "indeed_job_listing",
                "path": "dataset/indeed_job_listing.csv",
                "profile": "tabular-data-resource",
                "schema": {
                    "fields": [
                        {
                            "format": "default",
                            "name": "title",
                            "type": "string"
                        },
                        {
                            "format": "default",
                            "name": "location",
                            "type": "string"
                        },
                        {
                            "format": "default",
                            "name": "company",
                            "type": "string"
                        },
                        {
                            "format": "default",
                            "name": "description",
                            "type": "string"
                        },
                        {
                            "format": "default",
                            "name": "salary",
                            "type": "string"
                        },
                        {
                            "format": "default",
                            "name": "url",
                            "type": "string"
                        },
                        {
                            "format": "default",
                            "name": "published_at",
                            "type": "string"
                        },
                        {
                            "format": "default",
                            "name": "id",
                            "type": "string"
                        }
                    ],
                    "missingValues": [
                        ""
                    ]
                }
            },
            {
                "encoding": "utf-8",
                "format": "csv",
                "mediatype": "text/csv",
                "name": "stackoverflow_job_listing",
                "path": "dataset/stackoverflow_job_listing.csv",
                "profile": "tabular-data-resource",
                "schema": {
                    "fields": [
                        {
                            "format": "default",
                            "name": "link",
                            "type": "string"
                        },
                        {
                            "format": "default",
                            "name": "category",
                            "type": "string"
                        },
                        {
                            "format": "default",
                            "name": "title",
                            "type": "string"
                        },
                        {
                            "format": "default",
                            "name": "description",
                            "type": "string"
                        },
                        {
                            "format": "default",
                            "name": "published_at",
                            "type": "string"
                        },
                        {
                            "format": "default",
                            "name": "location",
                            "type": "string"
                        },
                        {
                            "format": "default",
                            "name": "stackoverflow_id",
                            "type": "integer"
                        },
                        {
                            "format": "default",
                            "name": "author",
                            "type": "string"
                        },
                        {
                            "format": "default",
                            "name": "location_country",
                            "type": "string"
                        },
                        {
                            "format": "default",
                            "name": "location_city",
                            "type": "string"
                        },
                        {
                            "format": "default",
                            "name": "updated_at",
                            "type": "string"
                        }
                    ],
                    "missingValues": [
                        ""
                    ]
                }
            }
        ]
    },
    "description": "This is a demo dataset to test and show dataherb.",
    "id": "git-dataherb-python-demo-dataset",
    "metadata_uri": "https://raw.githubusercontent.com/DataHerb/dataherb-python-demo-dataset-created/main/dataherb.json",
    "name": "Dataherb Demo Dataset",
    "source": "git",
    "uri": "https://github.com/DataHerb/dataherb-python-demo-dataset-created.git"
}
